A_YEAR: Year of survey,N_REGION_ISO: Region ISO 3166-2,H_URBRURAL: Urban-Rural,Q260: Sex,X003R: Age recoded (6 intervals),Q272: Language at home,Q273: Marital status,Q275R: Highest educational level: Respondent (recoded into 3 groups),Q287: Social class (subjective),Counts,S_INTLANGUAGE: Language in which interview was conducted,Q262: Age,Q279: Employment status,Q289: Religious denominations - major groups,Q2: Important in life: Friends,Q3: Important in life: Leisure time,Q4: Important in life: Politics,Q5: Important in life: Work,Q6: Important in life: Religion,Q18: Neighbors: Drug addicts,Q19: Neighbors: People of a different race,Q20: Neighbors: People who have AIDS,Q21: Neighbors: Immigrants/foreign workers,Q22: Neighbors: Homosexuals,Q23: Neighbors: People of a different religion,Q24: Neighbors: Heavy drinkers,Q25: Neighbors: Unmarried couples living together,Q26: Neighbors: People who speak a different language,Q27: One of main goals in life has been to make my parents proud,Q28: Pre-school child suffers with working mother,Q29: Men make better political leaders than women do,Q30: University is more important for a boy than for a girl,Q31: Men make better business executives than women do,Q32: Being a housewife just as fulfilling,Q33: Jobs scarce: Men should have more right to a job than women,Q34: Jobs scarce: Employers should give priority to (nation) people than immigrants,Q35: Problem if women have more income than husband,Q36: Homosexual couples are as good parents as other couples,Q37: Duty towards society to have children,Q38: It is children duty to take care of ill parent,Q39: People who don't work turn lazy,Q40: Work is a duty towards society,Q41: Work should  always come first even if it means less spare time,Q42: Basic kinds of attitudes concerning society,Q43: Future changes: Less importance placed on work,Q44: Future changes: More emphasis on technology,Q45: Future changes: Greater respect for authority,Q58: Trust: Your family,Q59: Trust: Your neighborhood,Q60: Trust: People you know personally,Q61: Trust: People you meet for the first time,Q62: Trust: People of another religion,Q63: Trust: People of another nationality,Q64: Confidence: Churches,Q65: Confidence: Armed Forces,Q66: Confidence: The Press,Q67: Confidence: Television,Q68: Confidence: Labor Unions,Q69: Confidence: The Police,Q70: Confidence: Justice System/Courts,Q71: Confidence: The Government,Q72: Confidence: The Political Parties,Q73: Confidence: Parliament,Q74: Confidence: The Civil Services,Q75: Confidence: Universities,Q76: Confidence: Elections,Q77: Confidence: Major Companies,Q78: Confidence: Banks,Q79: Confidence: The Environmental Protection Movement,Q80: Confidence: The Women's Movement,Q81: Confidence: Charitable or humanitarian organizations,Q82: Confidence: Major regional organization (combined from country-specific),Q83: Confidence: The United Nations (UN),Q84: Confidence: International Monetary Found (IMF),Q85: Confidence: International Criminal Court (ICC),Q86: Confidence: North Atlantic Treaty Organization (NATO),Q87: Confidence: The World Bank (WB),Q88: Confidence: The World Health Organization (WHO),Q89: Confidence: The World Trade Organization (WTO),Q90: International organizations: being effective vs being democratic,Q106: Incomes should be made more equal vs There should be greater incentives for individual effort,Q107: Private vs state ownership of business,Q108: Government's vs individual's responsibility,Q109: Competition good or harmful,Q110: Success: hard work vs luck,Q111: Protecting environment vs. Economic growth,Q112: Perceptions of corruption in the country,Q113: Involved in corruption: State authorities,Q114: Involved in corruption: Business executives,Q115: Involved in corruption: Local authorities,Q116: Involved in corruption: Civil service providers,Q117: Involved in corruption: Journalists and media,"Q119: Degree of agreement: On the whole, women are less corrupt than men",Q120: Risk to be held accountable for giving or receiving a bribe,Q121: Impact of immigrants on the development of the country,Q122: Immigration in your country: Fills useful jobs in the workforce,Q123: Immigration in your country: Strengthens cultural diversity,Q124: Immigration in your country: Increases the crime rate,Q125: Immigration in your country: Gives asylum to political refugees,Q126: Immigration in your country: Increases the risks of terrorism,Q127: Immigration in your country: Helps poor people establish new lives,Q128: Immigration in your country: Increases unemployment,Q129: Immigration in your country: Leads to social conflict,Q130: Immigration policy preference,Q142: Worries: Losing my job or not finding a job,Q143: Worries: Not being able to give one's children a good education,Q149: Freedom and Equality - Which more important,Q150: Freedom and security - Which more important,Q151: Willingness to fight for country,Q152: Aims of country: first choice,Q153: Aims of country: second choice,Q154: Aims of respondent: first choice,Q155: Aims of respondent: second choice,Q156: Most important: first choice,Q157: Most important: second choice,"Q158: Science and technology are making our lives healthier, easier, and more comfortable","Q159: Because of science and technology, there will be more opportunities for the next generation",Q160: We depend too much on science and not enough on faith,Q161: One of the bad effects of science is that it breaks down people’s ideas of right and wrong,Q162: It is not important for me to know about science in my daily life,"Q163: The world is better off, or worse off, because of science and technology",Q164: Importance of God,Q165: Believe in: God,Q166: Believe in: life after death,Q167: Believe in: hell,Q168: Believe in: heaven,"Q169: Whenever science and religion conflict,  religion is always right",Q170: The only acceptable religion  is my religion,Q174: Meaning of religion: To follow religious norms and ceremonies vs To do good to other people,Q175: Meaning of religion: To make sense of life after death vs To make sense of life in this world,Q176: Degree of agreement: Nowadays one often has trouble deciding which moral rules are the right ones to follow,Q177: Justifiable: Claiming government benefits to which you are not entitled,Q178: Justifiable: Avoiding a fare on public transport,Q179: Justifiable: Stealing property,Q180: Justifiable: Cheating on taxes,Q181: Justifiable: Someone accepting a bribe in the course of their duties,Q182: Justifiable: Homosexuality,Q183: Justifiable: Prostitution,Q184: Justifiable: Abortion,Q185: Justifiable: Divorce,Q186: Justifiable: Sex before marriage,Q187: Justifiable: Suicide,Q188: Justifiable: Euthanasia,Q189: Justifiable: For a man to beat his wife,Q190: Justifiable: Parents beating children,Q191: Justifiable: Violence against other people,"Q192: Justifiable: Terrorism as a political, ideological or religious mean",Q193: Justifiable: Having casual sex,Q194: Justifiable: Political violence,Q195: Justifiable: Death penalty,Q196: Government has the right: Keep people under video surveillance in public areas,Q197: Government has the right: Monitor all e-mails and any other information exchanged on the Internet,Q198: Government has the right: Collect information about anyone living in [COUNTRY] without their knowledge,Q224: How often in country's elections: Votes are counted fairly,Q225: How often in country's elections: Opposition candidates are prevented from running,Q226: How often in country's elections: TV news favors the governing party,Q227: How often in country's elections: Voters are bribed,Q228: How often in country's elections: Journalists provide fair coverage of elections,Q229: How often in country's elections: Election officials are fair,Q230: How often in country's elections: Rich people buy elections,Q231: How often in country's elections: Voters are threatened with  violence at the polls,Q232: How often in country's elections: Voters are offered a genuine choice in the elections,Q233: How often in country's elections: Women have equal opportunities to run the office,Q234: Some people think that having honest elections makes a lot of difference in their lives;  other people think that it doesn’t matter much,Q235: Political system: Having a strong leader who does not have to bother with parliament and elections,"Q236: Political system: Having experts, not government, make decisions according to what they think is best for the country",Q237: Political system: Having the army rule,Q238: Political system: Having a democratic political system,Q239: Political system: Having a system governed by religious law in which there are no political parties or elections,Q241: Democracy: Governments tax the rich and subsidize the poor,Q242: Democracy: Religious authorities interpret the laws,Q243: Democracy: People choose their leaders in free elections,Q244: Democracy: People receive state aid for unemployment,Q245: Democracy: The army takes over when government is incompetent,Q246: Democracy: Civil rights protect people’s liberty against oppression,Q247: Democracy: The state makes people's incomes equal,Q248: Democracy: People obey their rulers,Q249: Democracy: Women have the same rights as men
2019,JP-01 Hokkaido,Urban,Female,55-64,Japanese,Married,Higher,Upper middle class,4,Japanese,62,Full time (30 hours a week or more),Do not belong to a denomination,Rather important,Rather important,Don't know,Rather important,Not at all important,Mentioned,Not mentioned,Not mentioned,Mentioned,Not mentioned,Not mentioned,Mentioned,Mentioned,Not mentioned,Agree,Disagree,Strongly disagree,Strongly disagree,Disagree,Agree,Disagree,Agree strongly,Neither agree nor disagree,Agree,Neither agree nor disagree,Disagree strongly,Agree,Agree,Disagree,Our society must be gradually improved by reforms,Don't mind,Good thing,Bad thing,Trust completely,Do not trust very much,Trust somewhat,Do not trust at all,Don't know,Don't know,Not very much,Quite a lot,Quite a lot,Quite a lot,Don't know,Quite a lot,Quite a lot,Not very much,Not very much,None at all,Not very much,Not very much,Not very much,Quite a lot,Quite a lot,Not very much,Not very much,None at all,Quite a lot,Quite a lot,Quite a lot,Quite a lot,Quite a lot,Don't know,Quite a lot,Quite a lot,4,5,5,3,5,2,Don't know,10 There is abundant corruption in my country,Few of them,Few of them,Few of them,Few of them,Few of them,Hard to say,8,Quite bad,Hard to say,Agree,Agree,Hard to say,Agree,Agree,Agree,Hard to say,Place strict limits on the number of foreigners who can come here,A great deal,A great deal,Freedom,Security,No,A high level of economic growth,Don't know,Maintaining order in the nation,Fighting rising prices,A stable economy,The fight against crime,9,9,3,3,Completely disagree,5,3,Don't know,Yes,Don't know,Don't know,Strongly disagree,Strongly disagree,Do good to other people,Make sense of life in this world,3,Never justifiable,Never justifiable,Never justifiable,Never justifiable,Never justifiable,7,Never justifiable,3,5,5,2,5,Never justifiable,Never justifiable,Never justifiable,Never justifiable,2,Never justifiable,3,Probably should have the right,Definitely should not have the right,Definitely should not have the right,Very often,Not often,Not often,Not often,Fairly often,Very often,Not often,Not at all often,Fairly often,Fairly often,Very important,Fairly Bad,Fairly bad,Very bad,Very good,Very bad,7,Not an essential characteristic of democracy,An essential characteristic of democracy,8,Not an essential characteristic of democracy,An essential characteristic of democracy,3,Not an essential characteristic of democracy,An essential characteristic of democracy
2019,JP-12 Chiba,Urban,Male,65 and more years,Japanese,Married,Higher,Lower middle class,4,Japanese,65,Part time (less than 30 hours a week),Buddhist,Rather important,Rather important,Rather important,Rather important,Not at all important,Mentioned,Not mentioned,Not mentioned,Not mentioned,Not mentioned,Not mentioned,Mentioned,Not mentioned,Not mentioned,Agree,Disagree,Agree,Disagree,Disagree,Agree,Agree,Disagree,Neither agree nor disagree,Agree,Disagree,Agree,Disagree,Agree,Disagree,Our society must be gradually improved by reforms,Bad thing,Good thing,Bad thing,Trust completely,Trust somewhat,Trust completely,Trust somewhat,Trust somewhat,Trust somewhat,Not very much,A great deal,Quite a lot,Quite a lot,Not very much,Quite a lot,Quite a lot,Quite a lot,Not very much,Quite a lot,Quite a lot,Quite a lot,A great deal,Not very much,Not very much,Quite a lot,Quite a lot,Quite a lot,Quite a lot,Quite a lot,Quite a lot,Quite a lot,Quite a lot,Quite a lot,Quite a lot,Quite a lot,7,3,3,2,3,2,Protecting environment,3,Few of them,Few of them,Few of them,Few of them,Few of them,Agree,5,Quite bad,Agree,Hard to say,Agree,Agree,Agree,Agree,Hard to say,Agree,Let people come as long as there are jobs available,Not much,A great deal,Equality,Security,No,A high level of economic growth,A high level of economic growth,Maintaining order in the nation,Giving people more say in important government decisions,Progress toward a less impersonal and more humane society,A stable economy,5,8,2,2,Completely disagree,8,3,Yes,No,No,No,Disagree,Agree,Do good to other people,Make sense of life in this world,4,Never justifiable,Never justifiable,Never justifiable,Never justifiable,Never justifiable,5,Never justifiable,5,5,8,Never justifiable,5,Never justifiable,Never justifiable,Never justifiable,Never justifiable,Never justifiable,Never justifiable,5,Probably should have the right,Definitely should not have the right,Definitely should not have the right,Very often,Not at all often,Not often,Fairly often,Fairly often,Very often,Not often,Not often,Fairly often,Very often,Very important,Very bad,Fairly good,Very bad,Very good,Very bad,8,Not an essential characteristic of democracy,An essential characteristic of democracy,An essential characteristic of democracy,Not an essential characteristic of democracy,An essential characteristic of democracy,Not an essential characteristic of democracy,Not an essential characteristic of democracy,An essential characteristic of democracy
2019,JP-13 Tokyo,Urban,Female,35-44,Japanese,Married,Higher,Lower middle class,5,Japanese,41,Homemaker not otherwise employed,Do not belong to a denomination,Very important,Rather important,Not very important,Rather important,Not at all important,Mentioned,Not mentioned,Mentioned,Not mentioned,Not mentioned,Not mentioned,Mentioned,Not mentioned,Not mentioned,Agree,Disagree,Disagree,Disagree,Disagree,Agree,Neither agree nor disagree,Agree,Disagree,Agree,Neither agree nor disagree,Disagree,Agree,Agree,Disagree,Our society must be gradually improved by reforms,Don't mind,Good thing,Bad thing,Trust completely,Trust somewhat,Trust somewhat,Do not trust very much,Do not trust very much,Don't know,None at all,Quite a lot,Quite a lot,Quite a lot,Don't know,Quite a lot,Quite a lot,Not very much,Not very much,Don't know,Quite a lot,Quite a lot,Quite a lot,Quite a lot,Quite a lot,Not very much,Not very much,Not very much,Don't know,Quite a lot,Don't know,Don't know,Don't know,Don't know,Don't know,Don't know,3,5,5,5,4,5,Other answer,7,Few of them,Few of them,Few of them,Few of them,Few of them,Hard to say,6,"Neither good, nor bad",Hard to say,Agree,Agree,Hard to say,Agree,Agree,Hard to say,Hard to say,Let people come as long as there are jobs available,A great deal,Not much,Freedom,Security,Don't know,A high level of economic growth,Trying to make our cities and countryside more beautiful,Maintaining order in the nation,Fighting rising prices,A stable economy,The fight against crime,8,Completely agree,Completely disagree,Completely disagree,5,7,3,Yes,Don't know,Don't know,Don't know,Disagree,Don't know,Don't know,Don't know,4,Never justifiable,Never justifiable,Never justifiable,Never justifiable,Never justifiable,Always justifiable,Never justifiable,5,Always justifiable,8,3,8,Never justifiable,Never justifiable,Never justifiable,Never justifiable,5,Never justifiable,5,Probably should have the right,Probably should not have the right,Probably should not have the right,Very often,Don't know,Fairly often,Fairly often,Fairly often,Very often,Not often,Not often,Very often,Very often,Very important,Fairly Bad,Fairly bad,Very bad,Fairly good,Very bad,7,Not an essential characteristic of democracy,An essential characteristic of democracy,6,Not an essential characteristic of democracy,8,2,2,An essential characteristic of democracy
2019,JP-13 Tokyo,Urban,Female,45-54,Japanese,Married,Higher,Lower middle class,4,Japanese,45,Part time (less than 30 hours a week),Do not belong to a denomination,Rather important,Rather important,Rather important,Very important,Not very important,Mentioned,Not mentioned,Not mentioned,Not mentioned,Not mentioned,Not mentioned,Mentioned,Not mentioned,Not mentioned,Agree,Don't know,Disagree,Disagree,Disagree,Agree,Agree,Agree,Neither agree nor disagree,Agree,Agree,Agree,Agree,Agree,Disagree,Our society must be gradually improved by reforms,Don't mind,Good thing,Bad thing,Trust completely,Trust somewhat,Trust somewhat,Do not trust very much,Don't know,Do not trust very much,Not very much,Quite a lot,Quite a lot,Quite a lot,Quite a lot,Quite a lot,Quite a lot,Quite a lot,Quite a lot,Quite a lot,Quite a lot,Quite a lot,Quite a lot,Quite a lot,Quite a lot,Don't know,Quite a lot,Quite a lot,Don't know,Quite a lot,Don't know,Don't know,Don't know,Don't know,Quite a lot,Quite a lot,Don't know,7,3,3,4,5,Protecting environment,6,Few of them,Few of them,Few of them,Few of them,Few of them,Hard to say,5,"Neither good, nor bad",Agree,Agree,Disagree,Agree,Disagree,Agree,Disagree,Disagree,Let people come as long as there are jobs available,A great deal,A great deal,Freedom,Security,Don't know,A high level of economic growth,Making sure this country has strong defence forces,Fighting rising prices,Maintaining order in the nation,A stable economy,Progress toward a less impersonal and more humane  society,8,8,2,5,Don't know,8,4,Don't know,No,No,Yes,Disagree,Disagree,Do good to other people,Make sense of life in this world,5,Never justifiable,Never justifiable,Never justifiable,Never justifiable,Never justifiable,Always justifiable,Never justifiable,5,Always justifiable,Always justifiable,Never justifiable,8,Never justifiable,Never justifiable,Never justifiable,Never justifiable,Never justifiable,Never justifiable,5,Probably should have the right,Probably should have the right,Definitely should not have the right,Very often,Not often,Not often,Don't know,Fairly often,Fairly often,Not often,Not often,Fairly often,Very often,Very important,Very bad,Fairly good,Fairly bad,Very good,Very bad,5,2,5,8,2,5,3,2,An essential characteristic of democracy
2019,JP-13 Tokyo,Urban,Female,55-64,Japanese,Married,Higher,Lower middle class,6,Japanese,64,Homemaker not otherwise employed,Do not belong to a denomination,Very important,Rather important,Rather important,Rather important,Not at all important,Mentioned,Not mentioned,Not mentioned,Not mentioned,Not mentioned,Not mentioned,Mentioned,Not mentioned,Not mentioned,Agree,Disagree,Disagree,Disagree,Disagree,Don't know,Neither agree nor disagree,Neither agree nor disagree,Disagree,Agree,Disagree,Neither agree nor disagree,Agree,Neither agree or disagree,Disagree,Don't know,Bad thing,Don't mind,Bad thing,Trust completely,Don't know,Trust somewhat,Don't know,Don't know,Don't know,Not very much,Quite a lot,Quite a lot,Don't know,Quite a lot,Quite a lot,Quite a lot,Don't know,Don't know,Not very much,Don't know,Quite a lot,Quite a lot,Don't know,Quite a lot,Quite a lot,Don't know,Don't know,Don't know,Don't know,Don't know,Don't know,Don't know,Don't know,Quite a lot,Don't know,4,5,5,3,5,3,Don't know,5,Few of them,Few of them,Few of them,Few of them,Few of them,Hard to say,5,"Neither good, nor bad",Agree,Agree,Hard to say,Hard to say,Hard to say,Agree,Hard to say,Hard to say,Let people come as long as there are jobs available,A great deal,A great deal,Don't know,Security,Don't know,A high level of economic growth,Making sure this country has strong defence forces,Maintaining order in the nation,Giving people more say in important government decisions,A stable economy,The fight against crime,8,8,3,Don't know,5,Don't know,4,Don't know,Don't know,Don't know,Don't know,Disagree,Don't know,Do good to other people,Make sense of life in this world,5,Never justifiable,Never justifiable,Never justifiable,Never justifiable,Never justifiable,5,Never justifiable,2,5,3,Never justifiable,8,Never justifiable,Never justifiable,Never justifiable,Never justifiable,Never justifiable,Never justifiable,5,Probably should have the right,Probably should have the right,Probably should not have the right,Not often,Don't know,Not often,Fairly often,Fairly often,Don't know,Not often,Not at all often,Very often,Very often,Very important,Fairly Bad,Don't know,Very bad,Fairly good,Very bad,3,Not an essential characteristic of democracy,An essential characteristic of democracy,7,Not an essential characteristic of democracy,An essential characteristic of democracy,6,Not an essential characteristic of democracy,An essential characteristic of democracy
2019,JP-13 Tokyo,Urban,Male,55-64,Japanese,Married,Higher,Lower middle class,4,Japanese,55,Full time (30 hours a week or more),Do not belong to a denomination,Rather important,Very important,Rather important,Very important,Not very important,Mentioned,Not mentioned,Mentioned,Not mentioned,Not mentioned,Not mentioned,Mentioned,Not mentioned,Not mentioned,Agree,Don't know,Disagree,Disagree,Disagree,Don't know,Disagree,Neither agree nor disagree,Don't know,Agree strongly,Agree,Agree,Agree,Strongly agree,Disagree,Our society must be gradually improved by reforms,Bad thing,Good thing,Bad thing,Trust completely,Trust completely,Trust somewhat,Do not trust very much,Don't know,Trust somewhat,Not very much,Quite a lot,Not very much,Not very much,Don't know,Quite a lot,Quite a lot,Quite a lot,Not very much,Not very much,Quite a lot,Quite a lot,Quite a lot,Not very much,Not very much,Not very much,Not very much,Not very much,Not very much,Quite a lot,Quite a lot,Quite a lot,Not very much,Not very much,Quite a lot,Quite a lot,5,4,3,6,4,4,Protecting environment,7,Few of them,Few of them,Few of them,Few of them,Most of them,Agree,7,"Neither good, nor bad",Agree,Agree,Agree,Hard to say,Agree,Hard to say,Hard to say,Agree,Place strict limits on the number of foreigners who can come here,Very much,Very much,Freedom,Security,Don't know,Trying to make our cities and countryside more beautiful,Making sure this country has strong defence forces,Maintaining order in the nation,Fighting rising prices,The fight against crime,A stable economy,8,8,2,3,Completely disagree,8,2,No,No,No,No,Disagree,Disagree,Do good to other people,Make sense of life in this world,3,Never justifiable,Never justifiable,Never justifiable,Never justifiable,Never justifiable,3,Never justifiable,5,Always justifiable,Always justifiable,2,6,Never justifiable,Never justifiable,2,2,Never justifiable,2,8,Probably should have the right,Probably should not have the right,Probably should not have the right,Very often,Not often,Fairly often,Fairly often,Not often,Very often,Not often,Not often,Fairly often,Fairly often,Very important,Fairly Bad,Fairly bad,Very bad,Fairly good,Very bad,7,2,7,2,Not an essential characteristic of democracy,An essential characteristic of democracy,3,Not an essential characteristic of democracy,An essential characteristic of democracy
2019,JP-13 Tokyo,Urban,Male,65 and more years,Japanese,Married,Higher,Lower middle class,5,Japanese,66,Retired/pensioned,Do not belong to a denomination,Rather important,Very important,Rather important,Rather important,Not very important,Mentioned,Not mentioned,Mentioned,Mentioned,Not mentioned,Not mentioned,Mentioned,Not mentioned,Not mentioned,Agree,Disagree,Disagree,Disagree,Disagree,Agree,Disagree,Agree,Neither agree nor disagree,Agree,Disagree,Neither agree nor disagree,Agree,Agree,Disagree,Our society must be gradually improved by reforms,Bad thing,Good thing,Bad thing,Trust completely,Trust somewhat,Trust somewhat,Do not trust very much,Do not trust very much,Trust somewhat,Not very much,Quite a lot,Quite a lot,Quite a lot,Not very much,Quite a lot,Quite a lot,Not very much,Not very much,Quite a lot,Not very much,Quite a lot,Quite a lot,Not very much,Quite a lot,Not very much,Not very much,Not very much,Not very much,Quite a lot,Quite a lot,Quite a lot,Not very much,Not very much,Quite a lot,Not very much,7,7,3,5,3,4,Protecting environment,7,Few of them,Few of them,Few of them,Few of them,Few of them,Agree,5,Quite good,Agree,Hard to say,Agree,Hard to say,Hard to say,Disagree,Hard to say,Disagree,Let people come as long as there are jobs available,Not much,Not at all,Freedom,Security,Yes,A high level of economic growth,Making sure this country has strong defence forces,Maintaining order in the nation,Fighting rising prices,A stable economy,The fight against crime,8,8,3,3,3,8,2,No,No,No,No,Disagree,Disagree,Do good to other people,Make sense of life in this world,5,Never justifiable,Never justifiable,Never justifiable,Never justifiable,Never justifiable,5,2,2,5,5,2,2,Never justifiable,Never justifiable,Never justifiable,Never justifiable,Never justifiable,Never justifiable,Always justifiable,Definitely should have the right,Probably should have the right,Probably should not have the right,Very often,Not often,Not at all often,Fairly often,Fairly often,Very often,Not at all often,Not often,Very often,Very often,Very important,Very bad,Fairly bad,Very bad,Very good,Very bad,7,2,8,7,2,7,3,2,8
